[
    {
        "title": "إلغاء الخدمة الإلزامية في الجيش",
        "description": "ساعد إلغاء التجنيد الإلزامي على عودة الشباب المغترب ولم شمل الأهالي في سوريا دون حاجة لدفع بدل خدمة.",
        "source_url": "https://aawsat.news/rurs5",
        "date": "2025-01-23",
        "sector": "security",
        "impact": "high"
    },
    {
        "title": "عودة ملايين اللاجئين والنازحين إلى ديارهم",
        "description": "نجحت الحكومة الانتقالية في تحقيق استقرار نسبي في مناطق واسعة وهو ما شجع على عودة ملايين السوريين اللاجئين والنازحين إلى ديارهم.",
        "source_url": "https://www.unhcr.org/ar/news/press-releases/unhcr-historic-return-displaced-syrians-presents-opportunity-and-urgent",
        "date": "2025-12-08",
        "sector": "national-unity",
        "impact": "high"
    },
    {
        "title": "إعادة تأهيل المدارس",
        "description": "كانت عملية ترميم وإعادة تأهيل المدارس من أولويات وزارة التربية حيث أنهت ترميم ما يقارب ألف مدرسة وما يزال العمل مستمراً على مئات المدارس الأخرى في مختلف المحافظات.",
        "source_url": "https://sana.sy/education/2335128/",
        "date": "2025-11-23",
        "sector": "education",
        "impact": "high"
    },
    {
        "title": "توحيد الفصائل والسعي لتأسيس جيش وطني",
        "description": "نجح الجيش الجديد في ضم فصائل من تيارات مختلفة كما تم الاتفاق مع قسد لتندمج على شكل أربعة ألوية ضمن صفوفه ليكون جيشاً وطنياً جامعاً.",
        "source_url": "https://www.echoroukonline.com/%D8%A7%D9%84%D8%AC%D9%8A%D8%B4-%D8%A7%D9%84%D8%B3%D9%88%D8%B1%D9%8A-%D8%A3%D8%AF%D8%A7%D8%A9-%D8%AA%D9%88%D8%AD%D9%8A%D8%AF-%D9%84%D8%A7-%D9%85%D8%B8%D9%87%D8%B1-%D8%A7%D9%86%D9%82%D8%B3%D8%A7%D9%85",
        "date": "2026-02-13",
        "sector": "security",
        "impact": "high"
    },
    {
        "title": "رفع العقوبات الاقتصادية",
        "description": "سعت الحكومة إلى إعادة اكتساب ثقة المجتمع الدولي بأسرع وقت واستطاعت في فترة وجيزة أن تشجعهم على رفع العقوبات عن الدولة السورية.",
        "source_url": "https://www.france24.com/ar/%D8%A7%D9%84%D8%B4%D8%B1%D9%82-%D8%A7%D9%84%D8%A3%D9%88%D8%B3%D8%B7/20251217-%D8%A7%D9%84%D9%88%D9%84%D8%A7%D9%8A%D8%A7%D8%AA-%D8%A7%D9%84%D9%85%D8%AA%D8%AD%D8%AF%D8%A9-%D8%A7%D9%84%D9%83%D9%88%D9%86%D8%BA%D8%B1%D8%B3-%D8%B1%D9%81%D8%B9-%D8%A7%D9%84%D8%B9%D9%82%D9%88%D8%A8%D8%A7%D8%AA-%D8%B9%D9%86-%D8%B3%D9%88%D8%B1%D9%8A%D8%A7-%D9%82%D8%A7%D9%86%D9%88%D9%86-%D9%82%D9%8A%D8%B5%D8%B1-%D8%AF%D9%85%D8%B4%D9%82-%D8%A3%D8%AD%D9%85%D8%AF-%D8%A7%D9%84%D8%B4%D8%B1%D8%B9-%D8%A7%D9%82%D8%AA%D8%B5%D8%A7%D8%AF",
        "date": "2025-12-18",
        "sector": "foreign-relations",
        "impact": "high"
    },
    {
        "title": "إصلاح وتطوير عمل السفارات والقنصليات في الخارج",
        "description": "قامت الحكومة بإعادة هيكلة السفارات وتحسين الخدمات القنصلية من خلال وإطلاق تطبيق الكتروني لخدمة المغتربين",
        "source_url": "https://alikhbariah.com/%D9%85%D9%86%D9%87%D8%A7-%D8%A5%D9%86%D8%AC%D8%A7%D8%B2-%D8%A3%D9%84%D9%81-%D8%AC%D9%88%D8%A7%D8%B2-%D9%8A%D9%88%D9%85%D9%8A%D8%A7%D9%8B-%D8%AA%D8%B9%D8%AF%D9%8A%D9%84%D8%A7%D8%AA-%D8%AA%D9%86%D8%B8/",
        "date": "2025-11-23",
        "sector": "foreign-relations",
        "impact": "medium"
    },
    {
        "title": "فك العزلة الدولية وبناء العلاقات الدبلوماسية",
        "description": "نجحت وزارة الخارجية في فك العزلة الدولية عن سوريا وموازنة العلاقات مع الدول العظمى بما يخدم مصالح البلاد دون التورط مع أي معسكر معين بالإضافة للمشاركة بشكل فاعل في المنظمات الدولية.",
        "source_url": "https://www.jusoor.co/ar/details/%D8%AA%D9%82%D9%8A%D9%8A%D9%85-%D8%A7%D9%84%D8%B3%D9%8A%D8%A7%D8%B3%D8%A9-%D8%A7%D9%84%D8%AE%D8%A7%D8%B1%D8%AC%D9%8A%D8%A9-%D8%A8%D8%B9%D8%AF-%D8%B9%D8%A7%D9%85-%D8%B9%D9%84%D9%89-%D8%AA%D8%B4%D9%83%D9%8A%D9%84-%D8%A7%D9%84%D8%AD%D9%83%D9%88%D9%85%D8%A9-%D8%A7%D9%84%D8%B3%D9%88%D8%B1%D9%8A%D8%A9",
        "date": "2026-03-16",
        "sector": "foreign-relations",
        "impact": "medium"
    },
    {
        "title": "تحسن وضع الكهرباء",
        "description": "نجحت الحكومة السورية في تحسين واقع الكهرباء وساعات التغذية بشكل ملحوظ حيث كان إنتاج سوريا من الكهرباء بعد سقوط النظام 1400 ميجاوات، ووصل في 2026 إلى 3 آلاف و200 ميجاوات بالإضافة لمجموعة من المشاريع الاستراتيجية لبناء محطات جديدة خلال السنوات القادمة.",
        "source_url": "https://asharq.com/reports/172305/%D8%B3%D9%88%D8%B1%D9%8A%D8%A7-%D8%AA%D9%88%D9%82-%D8%B9-%D8%A7%D8%AA%D9%81%D8%A7%D9%82%D9%8A%D8%AA%D9%8A%D9%86-%D9%85%D8%B9-%D8%B4%D8%B1%D9%83%D8%AA%D9%8A%D9%86-%D8%B3%D8%B9%D9%88%D8%AF%D9%8A%D8%AA%D9%8A%D9%86-%D9%84%D8%AA%D8%B7%D9%88%D9%8A%D8%B1-%D8%A7%D9%84%D9%83%D9%87%D8%B1%D8%A8%D8%A7%D8%A1/",
        "date": "2026-02-16",
        "sector": "infrastructure",
        "impact": "high"
    },
    {
        "title": "مكافحة المخدرات وإغلاق منشآت صناعة الكبتاجون",
        "description": "في السنوات الأخيرة لحكم الأسد كانت سوريا مركزاً عالمياً لصناعة الكبتاجون وتصديره وهو ما كان يقلق دول المنطقة ونجحت الحكومة السورية الجديدة في تفكيك العديد من منشآت صناعتها التي كانت منتشرة في سوريا والتعاون مع دول المنطقة في جهود مكافحة المخدرات.",
        "source_url": "https://www.unodc.org/unodc/en/press/releases/2025/December/illicit-captagon-manufacturing-disrupted-following-regime-change-in-syria--says-new-unodc-research-brief.html",
        "date": "2025-12-22",
        "sector": "security",
        "impact": "medium"
    },
    {
        "title": "تطوير قطاع الطيران وخدمات الملاحة الجوية",
        "description": "تم إطلاق مشاريع لتطوير مطارات دمشق وحلب ودير الزور والقامشلي ورفع طاقتها الاستيعابية بالإضافة لتحسين خدمات الملاحة الجوية حيث عادت سوريا لتكون ممراً جوياً إقليمياً وبلغ عدد الطائرات التي عبرت الأجواء السورية أكثر من 15 ألف طائرة في شهر حزيران/يونيو 2026.",
        "source_url": "https://sana.sy/locals/2367246/",
        "date": "2026-01-05",
        "sector": "infrastructure",
        "impact": "medium"
    },
    {
        "title": "ظهور إعلام مستقل ناقد من داخل سوريا",
        "description": "شهدت سوريا قفزة كبيرة في حرية الصحافة بعد سقوط الأسد حيث ينشر الصحفيون والكتاب انتقادات دون أن يتعرضو للمضايقات والملاحقة لكن ما زال هناك مخاوف من أن نتجه نحو مزيد من التضييق.",
        "source_url": "https://ultrasyria.ultrasawt.com/%D8%A7%D9%84%D8%A5%D8%B9%D9%84%D8%A7%D9%85-%D9%81%D9%8A-%D8%B3%D9%88%D8%B1%D9%8A%D8%A7-%D8%A7%D9%84%D9%8A%D9%88%D9%85-%D8%AD%D8%B1%D9%8A%D8%A9-%D9%84%D8%A7-%D8%B1%D8%AC%D8%B9%D8%A9-%D8%B9%D9%86%D9%87%D8%A7-%D8%A3%D9%85-%D9%87%D8%A7%D9%85%D8%B4-%D9%85%D8%A4%D9%82%D8%AA-%D9%81%D9%8A-%D8%B3%D9%8A%D8%A7%D9%82-%D8%A7%D9%84%D8%AA%D9%85%D9%83%D9%8A%D9%86%D8%9F/%D8%B3%D9%84%D9%85%D8%A7%D9%86-%D8%B9%D8%B2-%D8%A7%D9%84%D8%AF%D9%8A%D9%86/%D8%B3%D9%8A%D8%A7%D8%B3%D8%A9",
        "date": "2026-04-30",
        "sector": "political-system",
        "impact": "medium"
    },
    {
        "title": "مشاريع لتطوير البنية التحتية في قطاع الاتصالات",
        "description": "وضعت وزارة الاتصالات خططاً استراتيجية لتطوير البنية التحتية وأعلنت عن عدة مشاريع تتناول أجزاء مختلفة من قطاع الاتصالات للنهوض بها خلال السنوات القادمة ومن أبرز تلك المشاريع: سيلك لينك وبرق اللذين دخلا عملية التنفيذ.",
        "source_url": "https://www.syria.tv/%D9%87%D9%8A%D9%83%D9%84-%D8%B3%D9%8A%D9%84%D9%83-%D9%84%D9%8A%D9%86%D9%83-%D9%88%D8%A8%D8%B1%D9%82-%D9%81%D9%8A-%D9%85%D8%B1%D8%AD%D9%84%D8%A9-%D8%A7%D9%84%D8%AA%D9%86%D9%81%D9%8A%D8%B0-%D9%88%D8%B3%D8%B9%D8%B1-%D8%A7%D9%84%D8%A5%D9%86%D8%AA%D8%B1%D9%86%D8%AA-%D8%A7%D8%B1%D8%AA%D9%81%D8%B9-%D9%81%D9%8A-%D8%B3%D9%88%D8%B1%D9%8A%D8%A7-%D9%84%D9%87%D8%B0%D9%87-%D8%A7%D9%84%D8%A3%D8%B3%D8%A8%D8%A7%D8%A8",
        "date": "2026-05-10",
        "sector": "technology",
        "impact": "medium"
    },
    {
        "title": "التعاون مع منظمة حظر الأسلحة الكيميائية",
        "description": "أبدت الحكومة السورية تعاونها الكامل مع الأمم المتحدة في ملف الأسلحة الكيميائية لتوثيق البرنامج والتخلص من الأسلحة حيث زار الفريق التقني لمنظمة حظر الأسلحة الكيميائية عشرات المواقع وأجرى مقابلات مع خبراء سابقين وساعد هذا الانفتاح في ترسيخ أن سوريا تسعى للتعاون مع المجتمع الدولي ولن تكون مصدر قلق لهم .",
        "source_url": "https://news.un.org/ar/story/2026/03/1144329",
        "date": "2026-03-10",
        "sector": "foreign-relations",
        "impact": "medium"
    },
    {
        "title": "زيادة الرواتب لموظفين القطاع العام",
        "description": "أصدر الرئيس الشرع عدة مراسيم لزيادة رواتب وأجور العاملين في الجهات العامة ومن ضمنهم أصحاب معاشات التقاعد.",
        "source_url": "https://www.ajnet.me/ebusiness/2026/6/21/%D9%88%D8%B2%D9%8A%D8%B1-%D8%A7%D9%84%D9%85%D8%A7%D9%84%D9%8A%D8%A9-%D8%A7%D9%84%D8%B3%D9%88%D8%B1%D9%8A-%D8%B2%D9%8A%D8%A7%D8%AF%D8%A9-%D8%A7%D9%84%D8%A3%D8%AC%D9%88%D8%B1",
        "date": "2026-06-21",
        "sector": "economy",
        "impact": "medium"
    },
    {
        "title": "تطوير القاعدة الوطنية الموحدة لسجلات العاملين في الدولة",
        "description": "قامت وزارة التنمية الإدارية ببناء القاعدة الوطنية الموحدة لسجلات العاملين في الدولة كأداة مركزية لضمان الشفافية الإدارية وتطوير أنظمة أكثر كفاءة تساعد في استثمار أفضل للموارد.",
        "source_url": "https://sana.sy/locals/2210319/",
        "date": "2025-04-22",
        "sector": "administration",
        "impact": "medium"
    },
    {
        "title": "إعادة الموظفين المفصولين بسبب مشاركتهم في الثورة",
        "description": "أعلنت مختلف المؤسسات الحكومية عن حملات لإعادة العاملين المفصولين من قبل نظام الأسد بسبب مشاركتهم في الثورة السورية.",
        "source_url": "https://www.enabbaladi.net/749105/%D8%A7%D9%84%D8%AD%D9%83%D9%88%D9%85%D8%A9-%D8%AA%D8%A8%D8%AF%D8%A3-%D8%A5%D8%B9%D8%A7%D8%AF%D8%A9-%D8%A7%D9%84%D9%85%D9%88%D8%B8%D9%81%D9%8A%D9%86-%D8%A7%D9%84%D8%B0%D9%8A%D9%86-%D9%81%D8%B5%D9%84/",
        "date": "2025-04-14",
        "sector": "administration",
        "impact": "medium"
    },
    {
        "title": "توحيد أغلب الاراضي السورية بعد سنوات من التقسيم",
        "description": "لأكثر من عقد كانت سوريا مقسمة لعدة مناطق لكل منها نموذج حكم وتوجهات مختلفة ولكن الحكومة نجحت في إحداث خرق كبير في هذه الصيغة والمضي قدماً في توحيد البلاد وإعادة دمج السوريين تحت راية ومنظومة موحدة.",
        "source_url": "",